{
  "$schema": "https://json-schema.org/draft/2020-12/schema",
  "$id": "urn:fawxzzy:platform:schemas:v1:mazer-app-data-adapter-contract",
  "title": "Mazer application-data adapter contract",
  "type": "object",
  "additionalProperties": false,
  "required": [
    "version",
    "contract_id",
    "status",
    "lifecycle",
    "apply_admitted",
    "generic_contract_path",
    "provider_canonical",
    "identity_and_activation",
    "canonicalization",
    "relations",
    "dependency_ordering",
    "snapshot_and_cas",
    "deletion_and_rollback",
    "public_receipt_policy",
    "dependency_gates"
  ],
  "properties": {
    "version": {
      "const": "1.0.0"
    },
    "contract_id": {
      "const": "mazer-app-data-adapter-contract"
    },
    "status": {
      "const": "CURRENT"
    },
    "lifecycle": {
      "type": "object",
      "additionalProperties": false,
      "required": [
        "source_contract",
        "execution"
      ],
      "properties": {
        "source_contract": {
          "const": "SOURCE_READY"
        },
        "execution": {
          "const": "EXECUTION_BLOCKED"
        }
      }
    },
    "apply_admitted": {
      "const": false
    },
    "generic_contract_path": {
      "const": "contracts/v1/transport/app-data-transport-contract.json"
    },
    "provider_canonical": {
      "type": "object",
      "additionalProperties": false,
      "required": [
        "migration_gate_path",
        "app",
        "provider_ledger_migration_count",
        "accepted_source_commit",
        "current_git_head",
        "current_git_migration_count",
        "accepted_package_sha256",
        "complete_catalog_sha256",
        "effect_mapping_count",
        "effect_mappings_sha256",
        "current_git_canonicality",
        "current_git_substitution_forbidden"
      ],
      "properties": {
        "migration_gate_path": {
          "const": "contracts/v1/gates/migration-gate-state.json"
        },
        "app": {
          "const": "mazer"
        },
        "provider_ledger_migration_count": {
          "const": 4
        },
        "accepted_source_commit": {
          "const": "3e96125da699aab21eb47c6635558b337ce0cf41"
        },
        "current_git_head": {
          "const": "3bd13233dc33fc721f8ccf105d2cc51f1a8dd8d4"
        },
        "current_git_migration_count": {
          "const": 3
        },
        "accepted_package_sha256": {
          "const": "80482b9bbfaf70b5980dd290b78def12d0af898cc10ee12f402b46d378fdbf83"
        },
        "complete_catalog_sha256": {
          "const": "7eae1b6d58f2eee065b9ba2030684e7171ae02eb2aaa520d191c9d78cee79436"
        },
        "effect_mapping_count": {
          "const": 4
        },
        "effect_mappings_sha256": {
          "const": "9a34f6518af88109a53a709b00fe942557b1d9c935f0505cf867ef152b477467"
        },
        "current_git_canonicality": {
          "const": "not_provider_canonical"
        },
        "current_git_substitution_forbidden": {
          "const": true
        }
      }
    },
    "identity_and_activation": {
      "type": "object",
      "additionalProperties": false,
      "required": [
        "canonical_human_key",
        "source_identity_ledger",
        "source_owner_key",
        "identity_rekey_required",
        "membership_relation",
        "membership_initial_state",
        "activation_subject_source",
        "caller_supplied_user_id_allowed",
        "profile_seed",
        "presentation_only_columns",
        "presentation_values_as_identity_evidence"
      ],
      "properties": {
        "canonical_human_key": {
          "const": "auth.users.id"
        },
        "source_identity_ledger": {
          "const": "platform_private.source_identity_ledger"
        },
        "source_owner_key": {
          "const": "user_id"
        },
        "identity_rekey_required": {
          "const": true
        },
        "membership_relation": {
          "const": "platform_shared.user_service_memberships"
        },
        "membership_initial_state": {
          "const": "pending"
        },
        "activation_subject_source": {
          "const": "auth.uid()"
        },
        "caller_supplied_user_id_allowed": {
          "const": false
        },
        "profile_seed": {
          "type": "object",
          "additionalProperties": false,
          "required": [
            "source_relation",
            "target_relation",
            "storage",
            "lookup",
            "consumption",
            "direct_pre_activation_insert_allowed",
            "exact_profile_parity_required",
            "missing_target_action",
            "exact_target_action",
            "conflicting_target_action"
          ],
          "properties": {
            "source_relation": {
              "const": "public.mazer_profiles"
            },
            "target_relation": {
              "const": "mazer.mazer_profiles"
            },
            "storage": {
              "const": "PRIVATE_COMMITMENT"
            },
            "lookup": {
              "const": "SERVER_SIDE_IDENTITY_MAPPING"
            },
            "consumption": {
              "const": "ATOMIC_WITH_ACTIVATION"
            },
            "direct_pre_activation_insert_allowed": {
              "const": false
            },
            "exact_profile_parity_required": {
              "const": true
            },
            "missing_target_action": {
              "const": "CREATE_FROM_SEED"
            },
            "exact_target_action": {
              "const": "IDEMPOTENT_REUSE"
            },
            "conflicting_target_action": {
              "const": "QUARANTINE"
            }
          }
        },
        "presentation_only_columns": {
          "const": [
            "display_name"
          ]
        },
        "presentation_values_as_identity_evidence": {
          "const": false
        }
      }
    },
    "canonicalization": {
      "type": "object",
      "additionalProperties": false,
      "required": [
        "transform_version",
        "complete_provider_catalog_column_order",
        "row_digest_includes_all_authoritative_columns",
        "private_key_commitments",
        "jsonb",
        "timestamp_with_time_zone",
        "numeric",
        "text",
        "raw_values_in_public_receipts"
      ],
      "properties": {
        "transform_version": {
          "const": "mazer-app-data-v1"
        },
        "complete_provider_catalog_column_order": {
          "const": true
        },
        "row_digest_includes_all_authoritative_columns": {
          "const": true
        },
        "private_key_commitments": {
          "const": true
        },
        "jsonb": {
          "const": "POSTGRES_JSONB_TEXT_UTF8"
        },
        "timestamp_with_time_zone": {
          "const": "UTC_MICROSECOND"
        },
        "numeric": {
          "const": "NORMALIZED_DECIMAL"
        },
        "text": {
          "const": "UTF8_EXACT"
        },
        "raw_values_in_public_receipts": {
          "const": false
        }
      }
    },
    "relations": {
      "type": "array",
      "minItems": 4,
      "maxItems": 4,
      "prefixItems": [
        {
          "$ref": "#/$defs/profile_relation"
        },
        {
          "$ref": "#/$defs/progression_relation"
        },
        {
          "$ref": "#/$defs/ai_relation"
        },
        {
          "$ref": "#/$defs/cycle_relation"
        }
      ],
      "items": false
    },
    "dependency_ordering": {
      "type": "object",
      "additionalProperties": false,
      "required": [
        "insert_update_order",
        "delete_order",
        "foreign_key_cycles",
        "cycle_staging_plan",
        "external_effects"
      ],
      "properties": {
        "insert_update_order": {
          "const": [
            "auth_mapping",
            "pending_membership",
            "atomic_profile_seed_activation",
            "progression",
            "cycle_receipts",
            "AI_mirror_rebuild"
          ]
        },
        "delete_order": {
          "const": [
            "AI_mirror_discard",
            "cycle_receipt_tombstones",
            "progression_tombstones",
            "profile_preserve"
          ]
        },
        "foreign_key_cycles": {
          "const": "NONE"
        },
        "cycle_staging_plan": {
          "const": "NOT_APPLICABLE_NO_CYCLE"
        },
        "external_effects": {
          "const": "QUARANTINED"
        }
      }
    },
    "snapshot_and_cas": {
      "type": "object",
      "additionalProperties": false,
      "required": [
        "required_snapshots",
        "complete_primary_key_set_comparison",
        "complete_canonical_row_digest_comparison",
        "revision_or_timestamp_only_proof_allowed",
        "accepted_expected_target",
        "unexpected_target_digest",
        "unexpected_target_overwrite_allowed",
        "matching_mutation"
      ],
      "properties": {
        "required_snapshots": {
          "const": [
            "S0",
            "S1",
            "S2"
          ]
        },
        "complete_primary_key_set_comparison": {
          "const": true
        },
        "complete_canonical_row_digest_comparison": {
          "const": true
        },
        "revision_or_timestamp_only_proof_allowed": {
          "const": false
        },
        "accepted_expected_target": {
          "const": [
            "ABSENT",
            "EXACT_DIGEST"
          ]
        },
        "unexpected_target_digest": {
          "const": "QUARANTINE"
        },
        "unexpected_target_overwrite_allowed": {
          "const": false
        },
        "matching_mutation": {
          "const": "IDEMPOTENT_REUSE"
        }
      }
    },
    "deletion_and_rollback": {
      "type": "object",
      "additionalProperties": false,
      "required": [
        "explicit_tombstones_required",
        "implicit_cascade_authority",
        "profile_delete_action",
        "membership_hard_delete",
        "rollback_order",
        "append_only_mutation_journal_required",
        "reverse_catch_up_to_source"
      ],
      "properties": {
        "explicit_tombstones_required": {
          "const": true
        },
        "implicit_cascade_authority": {
          "const": false
        },
        "profile_delete_action": {
          "const": "SUSPEND_AND_PRESERVE"
        },
        "membership_hard_delete": {
          "const": "FORBIDDEN"
        },
        "rollback_order": {
          "const": "REVERSE_DEPENDENCY_AND_COMMIT_ORDER"
        },
        "append_only_mutation_journal_required": {
          "const": true
        },
        "reverse_catch_up_to_source": {
          "const": "SEPARATE_EXPLICIT_AUTHORITY"
        }
      }
    },
    "public_receipt_policy": {
      "type": "object",
      "additionalProperties": false,
      "required": [
        "allowed_classes",
        "forbidden_classes"
      ],
      "properties": {
        "allowed_classes": {
          "const": [
            "aggregate_counts",
            "booleans",
            "non_identifying_high_water_marks",
            "quarantine_classes",
            "private_commitments",
            "digests"
          ]
        },
        "forbidden_classes": {
          "const": [
            "raw_rows",
            "primary_keys",
            "names",
            "emails",
            "usernames",
            "user_numbers_or_ranges",
            "uuids_or_ranges",
            "secrets",
            "project_refs",
            "sql",
            "payloads",
            "provider_responses",
            "machine_paths"
          ]
        }
      }
    },
    "dependency_gates": {
      "type": "object",
      "additionalProperties": false,
      "required": [
        "data_api_containment",
        "accepted_recovery_and_quarantined_restore",
        "faithful_contained_replay",
        "target_bootstrap",
        "shared_auth_identity_mapping",
        "service_membership_readiness",
        "fitness_adapter",
        "discordos_adapter",
        "target_apply"
      ],
      "properties": {
        "data_api_containment": {
          "const": "BLOCKED"
        },
        "accepted_recovery_and_quarantined_restore": {
          "const": "BLOCKED"
        },
        "faithful_contained_replay": {
          "const": "BLOCKED"
        },
        "target_bootstrap": {
          "const": "BLOCKED"
        },
        "shared_auth_identity_mapping": {
          "const": "BLOCKED"
        },
        "service_membership_readiness": {
          "const": "SOURCE_READY_EXECUTION_BLOCKED"
        },
        "fitness_adapter": {
          "const": "BLOCKED"
        },
        "discordos_adapter": {
          "const": "BLOCKED"
        },
        "target_apply": {
          "const": "BLOCKED"
        }
      }
    }
  },
  "$defs": {
    "base_relation": {
      "type": "object",
      "additionalProperties": false,
      "required": [
        "source_relation",
        "target_relation",
        "classification",
        "primary_key",
        "owner_key",
        "transport_mode",
        "accelerators",
        "accelerators_replace_complete_comparison"
      ],
      "properties": {
        "source_relation": {
          "type": "string"
        },
        "target_relation": {
          "type": "string"
        },
        "classification": {
          "type": "string"
        },
        "primary_key": {
          "type": "array",
          "minItems": 1,
          "uniqueItems": true,
          "items": {
            "type": "string"
          }
        },
        "owner_key": {
          "const": "user_id"
        },
        "transport_mode": {
          "type": "string"
        },
        "accelerators": {
          "type": "array",
          "uniqueItems": true,
          "items": {
            "type": "string"
          }
        },
        "accelerators_replace_complete_comparison": {
          "const": false
        },
        "rebuild_source": {
          "type": "string"
        },
        "rebuild_timing": {
          "type": "string"
        },
        "target_default_identity_generation_allowed": {
          "type": "boolean"
        },
        "allowed_operations": {
          "type": "array",
          "uniqueItems": true,
          "items": {
            "type": "string"
          }
        }
      }
    },
    "profile_relation": {
      "allOf": [
        {
          "$ref": "#/$defs/base_relation"
        },
        {
          "type": "object",
          "properties": {
            "source_relation": {
              "const": "public.mazer_profiles"
            },
            "target_relation": {
              "const": "mazer.mazer_profiles"
            },
            "classification": {
              "const": "AUTHORITATIVE_ACTIVATION_SEED"
            },
            "primary_key": {
              "const": [
                "user_id"
              ]
            },
            "transport_mode": {
              "const": "PRIVATE_SEED_THEN_ATOMIC_ACTIVATION"
            },
            "accelerators": {
              "const": [
                "revision"
              ]
            }
          }
        }
      ]
    },
    "progression_relation": {
      "allOf": [
        {
          "$ref": "#/$defs/base_relation"
        },
        {
          "type": "object",
          "properties": {
            "source_relation": {
              "const": "public.mazer_progression_states"
            },
            "target_relation": {
              "const": "mazer.mazer_progression_states"
            },
            "classification": {
              "const": "AUTHORITATIVE_STATE"
            },
            "primary_key": {
              "const": [
                "user_id"
              ]
            },
            "transport_mode": {
              "const": "CAS_APPLY_AFTER_ACTIVE_MEMBERSHIP"
            },
            "accelerators": {
              "const": [
                "revision"
              ]
            }
          }
        }
      ]
    },
    "ai_relation": {
      "allOf": [
        {
          "$ref": "#/$defs/base_relation"
        },
        {
          "type": "object",
          "required": [
            "rebuild_source",
            "rebuild_timing"
          ],
          "properties": {
            "source_relation": {
              "const": "public.mazer_ai_progression_states"
            },
            "target_relation": {
              "const": "mazer.mazer_ai_progression_states"
            },
            "classification": {
              "const": "DERIVED_INDEXED_MIRROR"
            },
            "primary_key": {
              "const": [
                "user_id",
                "runner_key"
              ]
            },
            "transport_mode": {
              "const": "EXCLUDE_AND_REBUILD"
            },
            "rebuild_source": {
              "const": "mazer.mazer_progression_states.state"
            },
            "rebuild_timing": {
              "const": "AFTER_AUTHORITATIVE_PARITY"
            },
            "accelerators": {
              "const": []
            }
          }
        }
      ]
    },
    "cycle_relation": {
      "allOf": [
        {
          "$ref": "#/$defs/base_relation"
        },
        {
          "type": "object",
          "required": [
            "target_default_identity_generation_allowed",
            "allowed_operations"
          ],
          "properties": {
            "source_relation": {
              "const": "public.mazer_cycle_receipts"
            },
            "target_relation": {
              "const": "mazer.mazer_cycle_receipts"
            },
            "classification": {
              "const": "AUTHORITATIVE_APPEND_ONLY_HISTORY"
            },
            "primary_key": {
              "const": [
                "id"
              ]
            },
            "transport_mode": {
              "const": "PRESERVE_IDENTITY_APPEND_ONLY"
            },
            "target_default_identity_generation_allowed": {
              "const": false
            },
            "allowed_operations": {
              "const": [
                "INSERT",
                "IDEMPOTENT_REUSE",
                "EXPLICIT_TOMBSTONE"
              ]
            },
            "accelerators": {
              "const": []
            }
          }
        }
      ]
    }
  }
}
