{
  "version": "1.0.0",
  "contract_id": "mazer-app-data-adapter-contract",
  "status": "CURRENT",
  "lifecycle": {
    "source_contract": "SOURCE_READY",
    "execution": "EXECUTION_BLOCKED"
  },
  "apply_admitted": false,
  "generic_contract_path": "contracts/v1/transport/app-data-transport-contract.json",
  "provider_canonical": {
    "migration_gate_path": "contracts/v1/gates/migration-gate-state.json",
    "app": "mazer",
    "provider_ledger_migration_count": 4,
    "accepted_source_commit": "3e96125da699aab21eb47c6635558b337ce0cf41",
    "current_git_head": "3bd13233dc33fc721f8ccf105d2cc51f1a8dd8d4",
    "current_git_migration_count": 3,
    "accepted_package_sha256": "80482b9bbfaf70b5980dd290b78def12d0af898cc10ee12f402b46d378fdbf83",
    "complete_catalog_sha256": "7eae1b6d58f2eee065b9ba2030684e7171ae02eb2aaa520d191c9d78cee79436",
    "effect_mapping_count": 4,
    "effect_mappings_sha256": "9a34f6518af88109a53a709b00fe942557b1d9c935f0505cf867ef152b477467",
    "current_git_canonicality": "not_provider_canonical",
    "current_git_substitution_forbidden": true
  },
  "identity_and_activation": {
    "canonical_human_key": "auth.users.id",
    "source_identity_ledger": "platform_private.source_identity_ledger",
    "source_owner_key": "user_id",
    "identity_rekey_required": true,
    "membership_relation": "platform_shared.user_service_memberships",
    "membership_initial_state": "pending",
    "activation_subject_source": "auth.uid()",
    "caller_supplied_user_id_allowed": false,
    "profile_seed": {
      "source_relation": "public.mazer_profiles",
      "target_relation": "mazer.mazer_profiles",
      "storage": "PRIVATE_COMMITMENT",
      "lookup": "SERVER_SIDE_IDENTITY_MAPPING",
      "consumption": "ATOMIC_WITH_ACTIVATION",
      "direct_pre_activation_insert_allowed": false,
      "exact_profile_parity_required": true,
      "missing_target_action": "CREATE_FROM_SEED",
      "exact_target_action": "IDEMPOTENT_REUSE",
      "conflicting_target_action": "QUARANTINE"
    },
    "presentation_only_columns": [
      "display_name"
    ],
    "presentation_values_as_identity_evidence": false
  },
  "canonicalization": {
    "transform_version": "mazer-app-data-v1",
    "complete_provider_catalog_column_order": true,
    "row_digest_includes_all_authoritative_columns": true,
    "private_key_commitments": true,
    "jsonb": "POSTGRES_JSONB_TEXT_UTF8",
    "timestamp_with_time_zone": "UTC_MICROSECOND",
    "numeric": "NORMALIZED_DECIMAL",
    "text": "UTF8_EXACT",
    "raw_values_in_public_receipts": false
  },
  "relations": [
    {
      "source_relation": "public.mazer_profiles",
      "target_relation": "mazer.mazer_profiles",
      "classification": "AUTHORITATIVE_ACTIVATION_SEED",
      "primary_key": [
        "user_id"
      ],
      "owner_key": "user_id",
      "transport_mode": "PRIVATE_SEED_THEN_ATOMIC_ACTIVATION",
      "accelerators": [
        "revision"
      ],
      "accelerators_replace_complete_comparison": false
    },
    {
      "source_relation": "public.mazer_progression_states",
      "target_relation": "mazer.mazer_progression_states",
      "classification": "AUTHORITATIVE_STATE",
      "primary_key": [
        "user_id"
      ],
      "owner_key": "user_id",
      "transport_mode": "CAS_APPLY_AFTER_ACTIVE_MEMBERSHIP",
      "accelerators": [
        "revision"
      ],
      "accelerators_replace_complete_comparison": false
    },
    {
      "source_relation": "public.mazer_ai_progression_states",
      "target_relation": "mazer.mazer_ai_progression_states",
      "classification": "DERIVED_INDEXED_MIRROR",
      "primary_key": [
        "user_id",
        "runner_key"
      ],
      "owner_key": "user_id",
      "transport_mode": "EXCLUDE_AND_REBUILD",
      "rebuild_source": "mazer.mazer_progression_states.state",
      "rebuild_timing": "AFTER_AUTHORITATIVE_PARITY",
      "accelerators": [],
      "accelerators_replace_complete_comparison": false
    },
    {
      "source_relation": "public.mazer_cycle_receipts",
      "target_relation": "mazer.mazer_cycle_receipts",
      "classification": "AUTHORITATIVE_APPEND_ONLY_HISTORY",
      "primary_key": [
        "id"
      ],
      "owner_key": "user_id",
      "transport_mode": "PRESERVE_IDENTITY_APPEND_ONLY",
      "target_default_identity_generation_allowed": false,
      "allowed_operations": [
        "INSERT",
        "IDEMPOTENT_REUSE",
        "EXPLICIT_TOMBSTONE"
      ],
      "accelerators": [],
      "accelerators_replace_complete_comparison": false
    }
  ],
  "dependency_ordering": {
    "insert_update_order": [
      "auth_mapping",
      "pending_membership",
      "atomic_profile_seed_activation",
      "progression",
      "cycle_receipts",
      "AI_mirror_rebuild"
    ],
    "delete_order": [
      "AI_mirror_discard",
      "cycle_receipt_tombstones",
      "progression_tombstones",
      "profile_preserve"
    ],
    "foreign_key_cycles": "NONE",
    "cycle_staging_plan": "NOT_APPLICABLE_NO_CYCLE",
    "external_effects": "QUARANTINED"
  },
  "snapshot_and_cas": {
    "required_snapshots": [
      "S0",
      "S1",
      "S2"
    ],
    "complete_primary_key_set_comparison": true,
    "complete_canonical_row_digest_comparison": true,
    "revision_or_timestamp_only_proof_allowed": false,
    "accepted_expected_target": [
      "ABSENT",
      "EXACT_DIGEST"
    ],
    "unexpected_target_digest": "QUARANTINE",
    "unexpected_target_overwrite_allowed": false,
    "matching_mutation": "IDEMPOTENT_REUSE"
  },
  "deletion_and_rollback": {
    "explicit_tombstones_required": true,
    "implicit_cascade_authority": false,
    "profile_delete_action": "SUSPEND_AND_PRESERVE",
    "membership_hard_delete": "FORBIDDEN",
    "rollback_order": "REVERSE_DEPENDENCY_AND_COMMIT_ORDER",
    "append_only_mutation_journal_required": true,
    "reverse_catch_up_to_source": "SEPARATE_EXPLICIT_AUTHORITY"
  },
  "public_receipt_policy": {
    "allowed_classes": [
      "aggregate_counts",
      "booleans",
      "non_identifying_high_water_marks",
      "quarantine_classes",
      "private_commitments",
      "digests"
    ],
    "forbidden_classes": [
      "raw_rows",
      "primary_keys",
      "names",
      "emails",
      "usernames",
      "user_numbers_or_ranges",
      "uuids_or_ranges",
      "secrets",
      "project_refs",
      "sql",
      "payloads",
      "provider_responses",
      "machine_paths"
    ]
  },
  "dependency_gates": {
    "data_api_containment": "BLOCKED",
    "accepted_recovery_and_quarantined_restore": "BLOCKED",
    "faithful_contained_replay": "BLOCKED",
    "target_bootstrap": "BLOCKED",
    "shared_auth_identity_mapping": "BLOCKED",
    "service_membership_readiness": "SOURCE_READY_EXECUTION_BLOCKED",
    "fitness_adapter": "BLOCKED",
    "discordos_adapter": "BLOCKED",
    "target_apply": "BLOCKED"
  }
}
